{"scenario_id":"RC:SCENARIO:S009","title":{"zh-Hans":"历史版本验证","en":"Historical version verification","ja":"履歴バージョン検証"},"description":{"zh-Hans":"审计角色只读验证规划版本 1 的历史状态与内容指纹。","en":"The auditor read-only verifies historical plan version 1 and its content proof.","ja":"監査者が計画バージョン1の履歴状態と内容証明を読み取り専用で検証する。"},"fixtures":["data/core-v0.1/release-lock.json","data/governance-v0.1/entities.json"],"actions":[{"step":1,"actor_id":"RC:ACTOR:006","operation":"VERIFY","target_id":"RC:PLAN:0001","occurred_at":"2030-03-09T09:00:00+08:00","request_ref":"scenarios/v0.1/S009/request.json","parameters":{}}],"expected_result_ref":"expected/v0.1/S009.json","tags":["history","audit","happy-path"]}