{"scenario_id":"RC:SCENARIO:S010","title":{"zh-Hans":"冲突更新","en":"Conflicting concurrent update","ja":"競合する並行更新"},"description":{"zh-Hans":"客户端仍以版本 1 为前置条件，但服务端对象已是版本 2。","en":"The client expects version 1 while the authoritative object is already version 2.","ja":"クライアントはバージョン1を前提とするが正本は既にバージョン2である。"},"fixtures":["scenarios/v0.1/S010/initial-state.json","data/governance-v0.1/transaction-rules.json"],"actions":[{"step":1,"actor_id":"RC:ACTOR:001","operation":"OPEN_AMENDMENT","target_id":"RC:PLAN:0001","occurred_at":"2030-03-10T09:00:00+08:00","request_ref":"scenarios/v0.1/S010/request.json","parameters":{}}],"expected_result_ref":"expected/v0.1/S010.json","tags":["concurrency","version-conflict","negative"]}