{"scenario_id":"RC:SCENARIO:S006","title":{"zh-Hans":"规划约束冲突","en":"Planning constraint conflict","ja":"計画制約の競合"},"description":{"zh-Hans":"编制者在合法调整操作中提出与基本农田控制范围冲突的用途变更。","en":"During an authorized amendment, a planner proposes a land-use change conflicting with the farmland control boundary.","ja":"正当な変更操作の中で計画作成者が農地制御境界と競合する用途変更を提案する。"},"fixtures":["data/core-v0.1/release-lock.json","data/governance-v0.1/entities.json"],"actions":[{"step":1,"actor_id":"RC:ACTOR:001","operation":"OPEN_AMENDMENT","target_id":"RC:PLAN:0001","occurred_at":"2030-03-06T09:00:00+08:00","request_ref":"scenarios/v0.1/S006/request.json","parameters":{"affected_control_id":"RC:CONTROL:0010","affected_parcel_id":"RC:PARCEL:000010"}}],"expected_result_ref":"expected/v0.1/S006.json","tags":["planning-constraint","negative"]}