{"scenario_id":"RC:SCENARIO:S008","title":{"zh-Hans":"缺少必要签名","en":"Missing required signature","ja":"必要署名の欠落"},"description":{"zh-Hans":"批准角色尝试使规划生效，但场景故意不提供 approval/signature fixture。","en":"The approver attempts activation while the required approval/signature proof is intentionally absent.","ja":"承認者が発効を試みるが必要な承認・署名証明を意図的に欠落させる。"},"fixtures":["scenarios/v0.1/S008/initial-state.json","data/governance-v0.1/documents/plan-v1-submission.json"],"actions":[{"step":1,"actor_id":"RC:ACTOR:003","operation":"ACTIVATE_PLAN","target_id":"RC:PLAN:0002","occurred_at":"2030-03-08T09:00:00+08:00","request_ref":"scenarios/v0.1/S008/request.json","parameters":{}}],"expected_result_ref":"expected/v0.1/S008.json","tags":["signature","negative"]}