{"scenario_id":"RC:SCENARIO:S001","title":{"zh-Hans":"正常规划成果登记","en":"Valid planning result registration","ja":"正常な計画成果登録"},"description":{"zh-Hans":"有权限的规划编制者登记一个新的规划对象。","en":"An authorized planner registers a new plan object.","ja":"権限を持つ計画作成者が新しい計画オブジェクトを登録する。"},"fixtures":["data/governance-v0.1/entities.json"],"actions":[{"step":1,"actor_id":"RC:ACTOR:001","operation":"CREATE_PLAN","target_id":"RC:PLAN:0003","occurred_at":"2030-03-01T09:00:00+08:00","request_ref":"scenarios/v0.1/S001/request.json","parameters":{}}],"expected_result_ref":"expected/v0.1/S001.json","tags":["registration","happy-path"]}