{"scenario_id":"RC:SCENARIO:S007","title":{"zh-Hans":"项目跨越受控边界","en":"Project crosses a controlled boundary","ja":"プロジェクトが制御境界を横断"},"description":{"zh-Hans":"建设申请与生态控制边界发生空间冲突。","en":"A development application conflicts spatially with the ecological control boundary.","ja":"開発申請が生態制御境界と空間的に競合する。"},"fixtures":["data/core-v0.1/release-lock.json"],"actions":[{"step":1,"actor_id":"RC:ACTOR:005","operation":"SUBMIT_PROJECT_APPLICATION","target_id":"RC:PARCEL:000001","occurred_at":"2030-03-07T09:00:00+08:00","request_ref":"scenarios/v0.1/S007/request.json","parameters":{}}],"expected_result_ref":"expected/v0.1/S007.json","tags":["spatial-conflict","negative"]}