{"scenario_id":"RC:SCENARIO:S003","title":{"zh-Hans":"正常审批并生效","en":"Valid review, approval and activation","ja":"正常な審査・承認・発効"},"description":{"zh-Hans":"已提交成果依次经过审查、批准和生效。","en":"A submitted plan passes review, approval and activation.","ja":"提出済み計画が審査・承認・発効を順に通過する。"},"fixtures":["scenarios/v0.1/S003/initial-state.json","data/governance-v0.1/lifecycle.json","data/governance-v0.1/documents-and-approvals.json"],"actions":[{"step":1,"actor_id":"RC:ACTOR:002","operation":"REVIEW_PASS","target_id":"RC:PLAN:0002","occurred_at":"2030-03-03T09:00:00+08:00","request_ref":"scenarios/v0.1/S003/request-review.json","parameters":{}},{"step":2,"actor_id":"RC:ACTOR:003","operation":"APPROVE_PLAN","target_id":"RC:PLAN:0002","occurred_at":"2030-03-03T10:00:00+08:00","request_ref":"scenarios/v0.1/S003/request-approve.json","parameters":{}},{"step":3,"actor_id":"RC:ACTOR:003","operation":"ACTIVATE_PLAN","target_id":"RC:PLAN:0002","occurred_at":"2030-03-03T11:00:00+08:00","request_ref":"scenarios/v0.1/S003/request-activate.json","parameters":{}}],"expected_result_ref":"expected/v0.1/S003.json","tags":["approval","happy-path"]}