{"scenario_id":"RC:SCENARIO:S004","title":{"zh-Hans":"无权限主体修改","en":"Unauthorized actor modification","ja":"権限のない主体による変更"},"description":{"zh-Hans":"建设申请者尝试发起规划调整。","en":"A development applicant attempts to amend the plan.","ja":"開発申請者が計画変更を試みる。"},"fixtures":["data/core-v0.1/release-lock.json","data/governance-v0.1/entities.json"],"actions":[{"step":1,"actor_id":"RC:ACTOR:005","operation":"OPEN_AMENDMENT","target_id":"RC:PLAN:0001","occurred_at":"2030-03-04T09:00:00+08:00","request_ref":"scenarios/v0.1/S004/request.json","parameters":{}}],"expected_result_ref":"expected/v0.1/S004.json","tags":["authorization","negative"]}