{"scenario_id":"RC:SCENARIO:S005","title":{"zh-Hans":"已批准文档篡改","en":"Tampered approved document","ja":"承認済み文書の改ざん"},"description":{"zh-Hans":"审计者验证被修改后的已批准规划文档。","en":"An auditor verifies a modified copy of an approved planning document.","ja":"監査者が変更された承認済み計画文書を検証する。"},"fixtures":["data/governance-v0.1/documents/plan-v1-submission.json","data/governance-v0.1/documents-and-approvals.json","scenarios/v0.1/S005/tampered-document.json"],"actions":[{"step":1,"actor_id":"RC:ACTOR:006","operation":"VERIFY","target_id":"RC:DOC:000001","occurred_at":"2030-03-05T09:00:00+08:00","request_ref":"scenarios/v0.1/S005/request.json","parameters":{}}],"expected_result_ref":"expected/v0.1/S005.json","tags":["hash","tamper","negative"]}