{"scenario_id":"RC:SCENARIO:S002","title":{"zh-Hans":"合法版本更新","en":"Authorized version update","ja":"正当なバージョン更新"},"description":{"zh-Hans":"编制者对有效规划发起调整并创建新版本。","en":"The planner opens an amendment on an effective plan.","ja":"計画作成者が有効な計画の変更を開始する。"},"fixtures":["data/core-v0.1/release-lock.json","data/governance-v0.1/lifecycle.json"],"actions":[{"step":1,"actor_id":"RC:ACTOR:001","operation":"OPEN_AMENDMENT","target_id":"RC:PLAN:0001","occurred_at":"2030-03-02T09:00:00+08:00","request_ref":"scenarios/v0.1/S002/request.json","parameters":{}}],"expected_result_ref":"expected/v0.1/S002.json","tags":["versioning","happy-path"]}